Date,Time,Type,Session,Title,Author(s),Abstract25-02-2014,13.30 _ 15.00,Paper,Web Search and Advertising,Predicting Response in Mobile Advertising with Hierarchical Importance-Aware Factorization Machine,"Richard J. Oentaryo, Ee-Peng Lim, Jia-Wei Low, David Lo, Michael Finegold","Mobile advertising has recently seen dramatic growth, fueled by the global proliferation of mobile phones and devices. The task of predicting ad response is thus crucial for maximizing business revenue. However, ad response data change dynamically over time, and are subject to cold-start situations in which limited history hinders reliable prediction. There is also a need for a robust regression estimation for high prediction accuracy, and good ranking to distinguish the impacts of different ads. To this end, we develop a Hierarchical Importance-aware Factorization Machine (HIFM),which provides an effective generic latent factor framework that incorporates importance weights and hierarchical learning. Comprehensive empirical studies on a real-world mobile advertising dataset show that HIFM outperforms the contemporary temporal latent factor models. The results also demonstrate the efficacy of the HIFMÍs importance-aware and hierarchical learning in improving the overall prediction and prediction in cold-start scenarios, respectively."25-02-2014,13.30 _ 15.00,Paper,Web Search and Advertising,Partner Tiering in Display Advertising,"Anand Bhalgat, Nitish Korula, Hennadiy Leontyev, Max Lin, Vahab Mirrokni","Display ads on the Internet are often sold by publishers to advertisers in bundles of thousands or millions of impressions over a particular time period. The ad delivery systems assign ads to pages on behalf of publishers to satisfy these contracts, and at the same time, try to maximize the overall quality of assignment. This is usually modeled in the literature as an online allocation problem, where contracts are represented by overall delivery constraints. However an important aspect of these contracts is missed by the classical formulation: a majority of these contracts are not between advertisers and publishers; a set of publishers is typically represented by a middle-man and advertisers buy inventory from the middle man. As publishers vary in quality and importance, advertisers prefer these publishers differently. Similarly, as the inventory of ads is limited, ad-delivery engine needs to prefer a high-quality publisher over a low quality publisher for supplying ads. We formulate this problem as a hierarchical online matching problem where each incoming impression has a level indicating its importance, and study its theoretical properties. We also design practical solutions to this problem and study their performance on real data sets"25-02-2014,15.30 _ 17.00,Practice and Experience Talk,Advertising,Response Prediction for Display Advertising,Olivier Chapelle,Click-through and conversation rates estimation are two core predictions tasks in display advertising. I will present a machine learning framework based on logistic regression that is specifically designed to tackle the specifics of display advertising. The resulting system has the following characteristics: it is easy to implement and deploy; it is highly scalable (we have trained it on terabytes of data); and it provides models with state-of-the-art accuracy.25-02-2014,15.30 _ 17.00,Paper,Advertising,Estimating Ad Group Performance in Sponsored Search,"Dawei Yin, Bin Cao, Jian-Tao, Sun, Brian D. Davison","In modern commercial search engines, the pay-per-click (PPC) advertising model is widely used in sponsored search. The search engines try to deliver ads which can produce greater click yields (the total number of clicks for the list of ads per impression). Therefore, predicting user clicks plays a critical role in sponsored search. The current ad-delivery strategy is a two-step approach which first predicts individual ad CTR for the given query and then selects the ads with higher predicted CTR. However, this strategy is naturally suboptimal and correlation between ads is often ignored under this strategy. The learning problem is focused on predicting individual performance rather than group performance which is the more important measurement. In this paper, we study click yield measurement in sponsored search and focus on the problem„predicting group performance (click yields) in sponsored search. To tackle all challenges in this problem„depth effects, interactive influence, cold start and sparseness of ad textual information„we first investigate several effects and propose a novel framework that could directly predict group performance for lists of ads. Our extensive experiments on a large-scale real-world dataset from a commercial search engine show that we achieve significant improvement by solving the sponsored search problem from the new perspective. Our methods noticeably outperform existing state-of-the-art approaches"25-02-2014,15.30 _ 17.00,Paper,Advertising,Hierarchical multitask learning: scalable algorithms and an application to conversion optimization in display advertising,"Amr Ahmed, Abhimanyu Das, Alexander J. Smola",Many estimation tasks come in groups and hierarchies of related problems. In this paper we propose a hierarchical model and a scalable algorithm to perform inference for multitask learning. It infers task correlation and subtask structure in a joint sparse setting. Implementation is achieved by a distributed subgradient oracle and the successive application of prox-operators pertaining to groups and sub-groups of variables. We apply this algorithm to conversion optimization in display advertising. Experimental results on over 1TB data for up to 1 billion observations and 1 million attributes show that the algorithm provides significantly better prediction accuracy while simultaneously being efficiently scalable by distributed parameter synchronization.25-02-2014,15.30 _ 17.00,Paper,Advertising,An Efficient Framework for Online Advertising Effectiveness Measurement and Comparison,"Pengyuan Wang, Yechao Liu, Marsha Meytlis, Han-Yun Tsao, Jian Yang, Pei Huang","In online advertising market it is crucial to provide advertisers with a reliable measurement of advertising effectiveness to make better marketing campaign planning. The basic idea for ad effectiveness measurement is to compare the performance (e.g., success rate) among users who were and who were not exposed to a certain treatment of ads. When a randomized experiment is not available, a naive comparison can be biased because exposed and unexposed populations typically have different features. One solid methodology for a fair comparison is to apply inverse propensity weighting with doubly robust estimation to the observational data. However the existing methods were not designed for the online advertising campaign, which usually suffers from huge volume of users, high dimensionality, high sparsity and imbalance. We propose an efficient framework to address these challenges in a real campaign circumstance. We utilize gradient boosting stumps for feature selection and gradient boosting trees for model fitting, and propose a subsampling-and-backscaling procedure that enables analysis on extremely sparse conversion data. The choice of features, models and feature selection scheme are validated with irrelevant conversion test. We further propose a parallel computing strategy, combined with the subsampling-and-backscaling procedure to reach computational efficiency. Our framework is applied to an online campaign involving millions of unique users, which shows substantially better model fitting and efficiency. Our framework can be further generalized to comparison of multiple treatments and more general treatment regimes, as sketched in the paper. Our framework is not limited to online advertising, but also applicable to other circumstances (e.g., social science) where a ïfairÍ comparison is needed with observational data."25-02-2014,15.30 _ 17.00,Paper,Advertising,LASER: A Scalable Response Prediction Platform For Online Advertising,"Deepak Agarwal, Bo Long, Jonathan Traupman, Doris Xin, Liang Zhang","We describe LASER, a scalable response prediction platform currently used as part of a social network advertising system. LASER enables the familiar logistic regression model to be applied to very large scale response prediction problems, including ones beyond advertising. Though the underlying model is well understood, we apply a whole-system approach to address model accuracy, scalability, explore-exploit, and real-time inference. To facilitate training with both large numbers of training examples and high dimensional features on commodity clustered hardware, we employ theAlternating Direction Method of Multipliers (ADMM). Because online advertising applications are much less static than classical presentations of response prediction, LASER employs a number of techniques that allows it to adapt in real time. LASER models can be divided into components with different re-training frequencies, allowing us to learn from changes in ad campaign performance frequently without incurring the cost of retraining larger, more stable sections of the model. Thompson sampling during online inference further helps by efficiently balancing exploration of new ads with exploitation of long running ones. To enable predictions made with the most recent feature data, we employ a range of techniques, including extensive caching and lazy evaluation, to permit real time, low latency scoring. LASER models are defined using a configuration language that ties together the training, validation, and inference pieces and permits even non-programming analysts to experiment with different model structures without modifications to code or interruptions to running servers. Finally, we show via extensive offline experiments and online A/B tests that this system provides significant benefits to prediction accuracy, gains in revenue and CTR, and reductions in system latency."26-02-2014,9.00 _ 10.30,Paper,Log analysis,Discovering Common Motifs in Cursor Movement Data for Improving Web Search Ranking,"Dmitry Lagun, Mikhail Ageev, Qi Guo, Eugene Agichtein","Web search behavior and interaction data, such as mouse cursor movements, can provide valuable information on how searchers examine and engage with the web search results. This interaction data is far richer than traditional search click data, and can be used to improve search ranking, evaluation, and presentation. Unfortunately, the diversity and complexity inherent in this interaction data make it more difficult to capture salient behavior characteristics through traditional feature engineering. To address this problem, we introduce a novel approach of automatically discovering frequent subsequences, or motifs, in mouse cursor movement data. In order to scale our approach to realistic datasets, we introduce novel optimizations for motif discovery, specifically designed for mining cursor movement data. As a practical application, we show that by encoding the motifs discovered from thousands of real web search sessions as features, enables significant improvements on result relevance estimation and re-ranking tasks, compared to a state-of-the-art baseline that relies on extensive feature engineering. These results, complemented with visualization and qualitative analysis, demonstrate that our approach is able to automatically capture key characteristics of mouse cursor movement behavior, providing a valuable new tool for search behavior analysis."26-02-2014,9.00 _ 10.30,Paper,Log analysis,Modeling Dwell Time to Predict Click-level Satisfaction,"Youngho Kim, Ahmed Hassan, Ryen W. White, Imed Zitouni","Clicks on search results are the most widely used behavioral signals for predicting search satisfaction. Even though clicks are correlated with satisfaction, they can also be noisy. Previous work has shown that clicks are affected by position bias, caption bias, and other factors. A popular heuristic for reducing this noise is to only consider clicks with long dwell time, usually equaling or exceeding 30 seconds. The rationale is that the more time a searcher spends on a page, the more likely they are to be satisfied with its contents. However, having a single threshold value assumes that users need a fixed amount of time to be satisfied with any result click, irrespective of the page chosen. In reality, clicked pages can differ significantly. Pages have different topics, readability levels, content lengths, etc. All of these factors may affect the amount of time spent by the user on the page. In this paper, we study the effect of different page characteristics on the time needed to achieve search satisfaction. We show that the topic of the page, its length and its readability level are critical in determining the amount of dwell time needed to predict whether any click is associated with satisfaction. We propose a method to model and provide a better understanding of click dwell time. We estimate click dwell time distributions for SAT (satisfied) or DSAT (dissatisfied) clicks for different click segments and use them to derive features to train a click-level satisfaction model. We compare the proposed model to baseline methods that use dwell time and other search performance predictors as features, and demonstrate that the proposed model achieves significant improvements. "26-02-2014,9.00 _ 10.30,Paper,Log analysis,User Modeling in Search Logs via A Nonparametric Bayesian Approach,"Hongning Wang, ChengXiang Zhai, Feng Liang, Anlei Dong, Yi Chang","SearchersÍ information needs are diverse and cover a broad range of topics; hence, it is important for search engines to accurately understand each individual userÍs search intents in order to provide optimal search results. Search log data,which records usersÍ search behaviors when interacting with search engines, provides a valuable source of information about usersÍ search intents. Therefore, properly characterizing the heterogeneity among the usersÍ observed search behaviors is the key to accurately understanding their search intents and to further predicting their behaviors. In this work, we study the problem of user modeling in the search log data and propose a generative model, dpRank, within a non-parametric Bayesian framework. By postulating generative assumptions about a userÍs search behaviors, dpRank identifies each individual userÍs latent search interests and his/her distinct result preferences in a joint manner. Experimental results on a large-scale news search log data set validate the effectiveness of the proposed approach, which not only provides in-depth understanding of a userÍs search intents but also benefits a variety of personalized applications."26-02-2014,9.00 _ 10.30,Paper,Log analysis,The Last Click: Why Users Give up Information Network Navigation,"Aju Thalappillil Scaria, Rose Marie Philip, Robert West, Jure Leskovec","An important part of finding information online involves clicking from page to page until an information need is fully satisfied. This is a complex task that can easily be frustrating and force users to give up prematurely. An empirical analysis of what makes users abandon click-based navigation tasks is hard, since most passively collected browsing logs do not specify the exact target page that a user was trying to reach. We propose to overcome this problem by using data collected via Wikispeedia, a Wikipedia-based human-computation game, in which users are asked to navigate from a startpage to an explicitly given target page (both Wikipedia articles) by only tracing hyperlinks between Wikipedia articles. Our contributions are two-fold. First, by analyzing the differences between successful and abandoned navigation paths, we aim to understand what types of behavior are indicative of users giving up their navigation task. We also investigate how users make use of back clicks during their navigation. We find that users prefer backtracking to high-degree nodes that serve as landmarks and hubs for exploring the network of pages. Second, based on our analysis, we build statistical models for predicting whether a user will finish or abandon a navigation task, and if the next action will be a back click. Being able to predict these events is important as it can potentially help us design more human-friendly browsing interfaces and retain users who would otherwise have given up navigating a website."26-02-2014,9.00 _ 10.30,Paper,Log analysis,Lessons from the Journey: A Query Log Analysis of Within-Session Learning,"Carsten Eickhoff, Jaime Teevan, Ryen White, Susan Dumais","The Internet is the largest source of information in the world. Search engines help people navigate the huge space of available data in order to acquire new skills and knowledge. In this paper, we present an in-depth analysis of sessions in which people explicitly search for new knowledge on the Web based on the log files of a popular search engine. We investigate within-session and cross-session developments of expertise, focusing on how the language and search behavior of a user on a topic evolves over time. In this way, we identify those sessions and page visits that appear to signicantly boost the learning process. Our experiments demonstrate a strong connection between clicks and several metrics related to expertise. Based on models of the user and their specific context, we present a method capable of automatically predicting, with good accuracy, which clicks will lead to enhanced learning. Our findings provide insight into how search engines might better help users learn as they search."26-02-2014,9.00 _ 10.30,Paper,Log analysis,Scalable k-Means,"Andrei Broder, Lluis Garcia-Pueyo, Vanja Josifovski, Sergei Vassilvitskii, Srihari Venkatesan","The k-means clustering algorithm has a long history and a proven practical performance, however it does not scale to clustering millions of data points into thousands of clusters in high dimensional spaces. The main computational bottle-neck is the need to recompute the nearest centroid for every data point at every iteration, a prohibitive cost when the number of clusters is large. In this paper we show how to reduce the cost of the k-means algorithm by large factors by adapting ranked retrieval techniques. Using a combination of heuristics, on two real life data sets the wall clock time per iteration is reduced from 445 minutes to less than 4, and from 705 minutes to 1.4, while the clustering quality remains within 0.5% of the k-means quality. The key insight is to invert the process of point-to-centroid assignment by creating an inverted index over all the points and then using the current centroids as queries to this index to decide on cluster membership. In other words, rather than each iteration consisting of ñpoints picking centroidsî, each iteration now consists of ñcentroids picking pointsî. This is much more efficient, but comes at the cost of leaving some points unassigned to any centroid. We show experimentally that the number of such points is low and thus they can be separately assigned once the final centroids are decided. To speed up the computation we sparsify the centroids by pruning low weight features. Finally, to further reduce the running time and the number of unassigned points, we propose a variant of the WAND algorithm that uses the results of the intermediate results of nearest neighbor computations to improve performance."26-02-2014,11.00 _ 12.30,Practice and Experience Talk,Recommender systems,Challenges and New Directions in Recommendation Systems,Guy Lebanon,"The construction of modern recommendation systems in industry owes a large debt to the discoveries of the academic community. However, the field of recommendation systems in industry is currently facing new challenges, which are not adequately addressed by the major research efforts in the academic community. I will survey the growing gap between academic and industry efforts in recommendation systems, consider several major challenges, and explore several new directions in this space."26-02-2014,11.00 _ 12.30,Paper,Recommender systems,Taxonomy Discovery for Personalized Recommendation,"Yuchen Zhang, Amr Ahmed, Vanja Josifovski, Alexander Smola","Personalized recommender systems based on latent factor models are widely used to increase sales in e-commerce. Suchsystems use the past behavior of users to recommend new items that are likely to be of interest to them. However,latent factor model suffer from sparse user-item interaction in online shopping data: for a large portion of items thatdo not have sufficient purchase records, their latent factors cannot be estimated accurately.In this paper, we propose a novel approach that automatically discovers the taxonomies from online shopping dataand jointly learns a taxonomy-based recommendation system. Out model is non-parametric and can learn the taxonomy structure automatically from the data. Since thetaxonomy allows purchase data to be shared between items, it effectively improves the accuracy of recommending tailitems by sharing strength with the more frequent items. Experiments on a large-scale online shopping dataset confirmthat our proposed model improves significantly over state-of-the-art latent factor models. Moreover, our model generateshigh-quality and human readable taxonomies. Finally, using the algorithm-generated taxonomy, our model even outperforms latent factor models based on the human-inducedtaxonomy, thus alleviating the need for costly manual taxonomy generation."26-02-2014,11.00 _ 12.30,Paper,Recommender systems,Who likes it more? Mining Worth-Recommending Items from Long Tails by Modeling Relative Preference,"Yu-Chieh Ho, Yi-Ting Chiang, Jane Yung-Jen Hsu","Recommender systems are useful tools that help people to filter and explore massive information. While the accuracy of recommender systems is important, many recent research indicated that focusing merely on accuracy not only is insufficient to meet user needs, but also may be harmful. Other characteristics such as novelty, unexpectedness and diversity should also be taken into consideration. Previous work has shown that more the sales of long-tail items could be more beneficial to both customers and some business models. However, the majority of collaborative filtering approaches tends to recommend popular selling items. In this work, we focus on long-tail item promotion and aggregate diversity enhancement, and propose a novel approach which diversifies the results of recommender systems by considering ñrecommendationsî as resources to be allocated to the items. Our approach increases the quantity and quality of long-tail item recommendations by adding more variation into the recommendation and maintains a certain level of accuracy simultaneously. The experimental results show that this approach can discover more worth-recommending items from Long Tails and improves user experience."26-02-2014,11.00 _ 12.30,Paper,Recommender systems,On Building Entity Recommender Systems Using User Click Log and Freebase Knowledge,"Xiao Yu, Hao Ma, Bo-June (Paul) Hsu, Jiawei Han","Due to their commercial value, search engines and recommender systems have become two popular research topics in both industry and academia over the past decade. Although these two fields have been actively and extensively studied separately, researchers are beginning to realize the importance of the scenarios at their intersection: providing an integrated search and information discovery user experience. In this paper, we study a novel application, i.e., personalized entity recommendation for search engine users, by utilizing user click log and the knowledge extracted fromFreebase. To better bridge the gap between search engines and recommender systems, we first discuss important heuristics and features of the datasets. We then propose a generic, robust, and time-aware personalized recommendation framework to utilize these heuristics and features at different granularity levels. Using movie recommendation as a case study, with user click log dataset collected from a widely used commercial search engine, we demonstrate the effectiveness of our proposed framework over other popular and state-of-the-art recommendation techniques."26-02-2014,14.00 _ 15.30,Practice and Experience Talk,Recommender systems and networks,Love: Recommended,Vaclav Petricek,"Humans have a mixed record in choosing romantic partners. Are looks or brains more important for a happy marriage? Matchmaking is an age-old concept that has been revolutionized with the advent of Internet. Suddenly the pool of potential partners that one can plausibly consider has exploded and thanks to the move of courtship online we are now able to collect and analyze unprecedented amounts of data on romantic interactions. If you are looking for love you may want to take advantage of this accumulated knowledge to give yourself a leg up. However making causal inferences aka ñDating adviceî can be problematic due to various sample biases. I will instead show how we leverage this rich data, hadoop, vowpal wabbit, GBMs, graph optimization, and contextual bandit techniques to build a matchmaking system that improves your chances of a happy marriage. I will focus specifically on how we approach solving these three problems: Compatibility: matching for the long term based on psychological traits; Affinity: modeling immediate attraction; Distribution: who to introduce to who and when Did you know that _ according to a recent PNAS study _ eHarmony couples are happier and less likely to break up or divorce than couples that met offline or through all other dating sites combined?"