Date,Time,Type,Session,Title,Author(s),Abstract24-02-2014,9.00 _ 12.30,Tutorial,Tutorial 1,Exploration and Mining of Web Repositories,"Nan Zhang, Gautam Das","With the proliferation of very large data repositories hidden behind web interfaces, e.g., keyword search, form-like search and hierarchical/graph-based browsing interfaces forAmazon.com, eBay.com, etc., efficient ways of searching, exploring and/or mining such web data are of increasing importance.There are two key challenges facing these tasks: how to properly understand web interfaces, and how to bypass the interface restrictions. In this tutorial, we start with a general overview of web search and data mining, including various exciting applications enabled by the effective search, exploration, and mining of web repositories. Then, we focus on the fundamental developments in the field, including web interface understanding, crawling, sampling, and data analytics over web repositories with various types of interfaces. We also discuss the potential changes required for query processing, data mining and machine learning algorithms to be applied to web data.Our goal is two-fold: one is to promote the awareness of existing web data search/exploration/mining techniques among all web researchers who are interested in leveraging web data, and the other is to encourage researchers, especially those who have not previously worked in web search and mining before, to initiate their own research in these exciting areas."24-02-2014,9.00 _ 12.30,Tutorial,Tutorial 1,Multilingual Probabilistic Topic Modeling and its Applications in Web Mining and Search,"Marie-Francine Moens, Ivan Vuli _","Multilingual topic models are a fairly novel group of unsupervised, language-independent and generative machine learning models. This tutorial covers all key aspects of their probabilistic framework and demonstrates how to easily integrate these models into frameworks for cross-lingual and multilingual Web mining and search."24-02-2014,9.00 _ 12.30,Tutorial,Tutorial 1,Entity Linking and Retrieval for Semantic Search,Edgar Meij,"More and more search engine users are expecting direct answers to their information needs, rather than links to documents. Semantic search and its recent applications enabled search engines to organize their wealth of information around entities. Entity linking and retrieval provide the building stones for organizing the web of entities. This tutorial aims to cover all facets of semantic search from a unified point of view and connect real-world applications with results from scientific publications. We provide a comprehensive overview of entity linking and retrieval in the context of semantic search and thoroughly explore techniques for query understanding, entity-based retrieval and ranking on unstructured text, structured knowledge repositories, and a mixture of these. We point out the connections between published approaches and applications, and provide hands-on examples on real-world use cases and datasets."24-02-2014,14.00 _ 17.30,Tutorial,Tutorial 2,"Big Graph Mining for the Web and Social Media: Algorithms, Anomaly Detection and Applications","U Kang, Leman Akoglu, Duen Horng Chau","Graphs are everywhere: social networks, computer networks, mobile call networks, the World Wide Web, protein interaction networks, and many more. The lower cost of disk storage, the success of social networking websites and Web2.0 applications, and the high availability of data sources lead to graphs being generated at unprecedented size. They are now measured in terabytes or even petabytes, with more than billions of nodes and edges. Finding patterns on large graphs have a lot of applications including cyber security on the Web, social media mining (Facebook, Twitter), and fraud detection, among others. This tutorial will cover topics related to finding patterns and anomalies and sensemaking in large-scale graphs with applications to real-world problems in social media and the Web. Specifically, we aim to answer the following questions: How can we scale up graph mining algorithms for massive graphs with billions of edges? How can we find anomalies in such large-scale graphs? How can we make sense of disk-resident large graphs, what and how can we do visual analytics? How can we use the algorithms and anomaly detection techniques to solve challenging real-world problems that play key roles in social media and the Web? Our tutorial consists of three main parts. We start with scalable graph mining algorithms for billion-scale graphs, including structure analysis, eigensolvers, storage and indexing, and graph layout and graph compression. Next we describe anomaly detection techniques for large scale graphs with applications on social media. Finally, we discuss visual analytics techniques which leverage these algorithms and anomaly detection techniques in the previous parts."24-02-2014,14.00 _ 17.30,Tutorial,Tutorial 2,"Diversity and Novelty in Web Search, Recommender Systems and Data Streams","Rodrygo L. T. Santos, Pablo Castells, Ismail Sengor Altingovde, Fazil Can","This tutorial aims to provide a unifying account of current research on diversity and novelty in the domains of web search, recommender systems, and data stream processing."24-02-2014,14.00 _ 17.30,Tutorial,Tutorial 2,Behavioral Data Mining and Network Analysis in Massive Online Games,"Muhammad Aurangzeb Ahmad, Jaideep Srivastava","The last decade has been characterized by an explosion of social media in a variety of forms. Since the data is captured in digital form it has become possible for the first time to study human behavior at a massive scale. Not only is it possible to address traditional questions in the social sciences regarding collective dynamics of human behaviors but it is also possible to study new types of human behaviors which have arisen as a result of usage of new mediums like Twitter, YouTube, Facebook, onlie games etc. Each of these mediums has its respective limitations and affordances. Out of all these mediums the most complex and data rich medium is that of Massive Online Games (MOGs). MOGs refer to massive online persistent environments (World of Warcraft, EVE Online, EverQuest etc) shared by millions of people . In general these environments are characterized by a rich array of activities and social interactions with a wide array of behaviors e.g., cooperation, trade, quest, deceit, mentoring etc. Such environments allow one to study human behavior at a level of granularity where it was not possible to do so previously. Given the challenges associated with analyzing this type of data traditional techniques in data mining and social network analysis have to be extended with insights from the social sciences.The tutorial will cover predictive and generative models in the study of MOGs. Additionally we will cover some SNA techniques which are more appropriate for MOGs given the multi-dimensionality of the data (P*/ERGM Models, IRBased Network Analysis, Hypergrah based Techniques, Co-extensive Social Networks etc). We also describe the various ways in which MOGs exhibit similarities to the real world, e.g., economic behaviors, clandestine behaviors, mentoring etc.)"25-02-2014,10.30 _ 12.00,Paper,Web Search,Improving the Efficiency of Multi-site Web Search Engines,"Guillem Francès, Xiao Bai, B. Barla Cambazoglu, Ricardo Baeza-Yates","A multi-site web search engine is composed of a number of search sites geographically distributed around the world. Each search site is typically responsible for crawling and indexing the web pages that are in its geographical neighborhood. A query is selectively processed on a subset of search sites that are predicted to return the best-matching results. The scalability and efficiency of multi-site web search engines have attracted a lot of research attention in recent years. In particular, research has focused on replicating important web pages across sites, forwarding queries to relevant sites, and caching results of previous queries. Yet, these problems have only been studied in isolation, but no prior work has properly investigated the interplay between them. In this paper, we take this challenge up and conduct what we believe is the first comprehensive analysis of a full stack of techniques for efficient multi-site web search. Specifically, we propose a document replication technique that improves the query locality of the state-of-the-art approaches with various replication budget distribution strategies. We devise a machine learning approach to decide the query forwarding patterns, achieving a significantly lower false positive ratio than a state-of-the-art thresholding approach with little negative impact on search result quality. We propose three result caching strategies that reduce the number of forwarded queries and analyze the trade-off they introduce in terms of storage and network overheads. Finally, we show that the combination of the best-of-the-class techniques yields very promising search efficiency, rendering multi-site, geographically distributed web search engines an attractive alternative to centralized web search engines."25-02-2014,10.30 _ 12.00,Paper,Web Search,A Self-Adapting Latency/Power Tradeoff Model for Replicated Search Engines,"Ana Freire, Craig Macdonald, Nicola Tonellotto, Iadh Ounis, Fidel Cacheda","For many search settings, distributed/replicated search engines deploy a large number of machines to ensure efficient retrieval. This paper investigates how the power consumption of a replicated search engine can be automatically reduced when the system has low contention, without compromising its efficiency. We propose a novel self-adapting model to analyse the trade-off between latency and power consumption for distributed search engines. When query volumes are high and there is contention for the resources, the model automatically increases the necessary number of active machines in the system to maintain acceptable query response times. On the other hand, when the load of the system is low and the queries can be served easily, the model is able to reduce the number of active machines, leading to power savings. The model bases its decisions on examining the current and historical query loads of the search engine. Our proposal is formulated as a general dynamic decision problem, which can be quickly solved by dynamic programming in response to changing query loads. Thorough experiments are conducted to validate the usefulness of the proposed adaptive model using historical Web search traffic submitted to a commercial search engine. Our results show that our proposed self-adapting model can achieve an energy saving of 33% while only degrading mean query completion time by 10 ms compared to a baseline that provisions replicas based on a previous day's traffic."25-02-2014,10.30 _ 12.00,Paper,Web Search,"Heterogeneous Graph-Based Intent Learning with Queries, Web Pages and Wikipedia Concepts","Xiang Ren, Yujing Wang, Xiao Yu, Jun Yan, Zheng Chen, Jiawei Han","The problem of learning user search intents has attracted intensive attention from both industry and academia. However, state-of-the-art intent learning algorithms suffer from different drawbacks when only using a single type of data source. For example, query text has difficulty in distinguishing ambiguous queries; search log is biased to the order of search results and usersÍ noisy click behaviors. In this work, we for the first time leverage three types of objects, namely queries, web pages and Wikipedia concepts collaboratively for learning generic search intents and construct a heterogeneous graph to represent multiple types of relationships between them. A novel unsupervised method called heterogeneous graph-based soft-clustering is developed to derive an intent indicator for each object based on the constructed heterogeneous graph. With the proposed co-clustering method, one can enhance the quality of intent understanding by taking advantage of different types of data, which complement each other, and make the implicit intents easier to interpret with explicit knowledge from Wikipedia concepts. Experiments on two real-world datasets demonstrate the power of the proposed method where it achieves a 9.25% improvement in terms of NDCG on search ranking task and a 4.67% enhancement in terms of Rand index on object co-clustering task compared to the best state-of-the-art method."25-02-2014,10.30 _ 12.00,Paper,Web Search,Exploiting user disagreement for search evaluation: an experimental approach,"Thomas Demeester, Robin Aly, Djoerd Hiemstra, Dong Nguyen, Dolf Trieschnigg, Chris Develder","To express a more nuanced notion of relevance as compared to binary judgments, graded relevance levels can be used for the evaluation of search results. Especially in Web search, users strongly prefer top results over less relevant results, and yet they often disagree on which are the top results for a given information need. Whereas previous works have generally considered disagreement as a negative effect, this paper proposes a method to exploit this user disagreement by integrating it into the evaluation procedure. First, we present experiments that investigate the user disagreement. We argue that, with a high disagreement,lower relevance levels might need to be promoted more than in the case where there is global consensus on the top results. This is formalized by introducing the User Disagreement Model, resulting in a weighting of the relevance levels with a probabilistic interpretation. A validity analysis is given, and we explain how to integrate the model with well-established evaluation metrics. Finally, we discuss a specific application of the model, in the estimation of suitable weights for the combined relevance of Web search snippets and pages."25-02-2014,10.30 _ 12.00,Paper,Web Search,Improving Search Relevance for Short Query in Community Question Answering,"Haocheng Wu, Wei Wu, Ming Zhou, Enhong Chen, Lei Duan, Heung-Yeung Shum","Relevant question retrieval and ranking is a typical task in community question answering (CQA). Existing methods mainly focus on long and syntactically structured queries. However, when an input query is short, the task becomes challenging, due to a lack information regarding user intent. In this paper, we mine different types of user intent from various sources for short queries. With these intent signals, we propose a new intent-based language model. The model takes advantage of both state-of-the-art relevance models and the extra intent information mined from multiple sources. We further employ a state-of-the-art learning-to-rank approach to estimate parameters in the model from training data. Experiments show that by leveraging user intent prediction, our model significantly outperforms the state-of-the-art relevance models in question search."25-02-2014,10.30 _ 12.00,Paper,Web Search,Struggling or Exploring? Disambiguating Search Sessions,"Ahmed Hassan, Ryen W. White, Susan T. Dumais, and Yi-Min Wang","Web searchers often exhibit directed search behaviors such as navigating to a particular Website. However, in many circumstances they exhibit different behaviors that involve issuing many queries and visiting many results. In such cases, it is not clear whether the userÍs rationale is to intentionally explore the results or whether they are struggling to find the information they seek. Being able to disambiguate between these types of long search sessions is important for search engines both in performing retrospective analysis to understand search success, and in developing real-time support to assist searchers. The difficulty of this challenge is amplified since many of the characteristics of exploration (e.g., multiple queries, long duration) are also observed in sessions where people are struggling. In this paper, we analyze struggling and exploring behavior in Web search using log data from a commercial search engine. We first compare and contrast search behaviors along a number dimensions, including query dynamics during the session. We then build classifiers that can accurately distinguish between exploring and struggling sessions using behavioral and topical features. Finally, we show that by considering the struggling/exploring prediction we can more accurately predict search satisfaction. "25-02-2014,10.30 _ 12.00,Paper,Web Search,Democracy is Good for Ranking: Towards Multi-view Rank Learning and Adaptation in Web Search,"Wei Gao, Pei Yang","Web search ranking models are learned from features originated from different views or perspectives of document relevancy, such as query dependent or independent features.This seems intuitively conformant to the principle of multi-view approach that leverages distinct complementary views to improve model learning. In this paper, we aim to obtain optimal separation of ranking features into non-overlapping subsets (i.e., views), and use such different views for rank learning and adaptation. We present a novel semi-supervised multi-view ranking model, which is then extended into an adaptive ranker for search domains where no training data exists. The core idea is to proactively strengthen view consistency (i.e., the consistency between different rankings each predicted by a distinct view-based ranker) especially when training and test data follow divergent distributions. For this purpose, we propose a unified framework based on list-wise ranking scheme to mutually reinforce the view consistency of target queries and the appropriate weighting of source queries that act as prior knowledge. Based on LETOR and Yahoo Learning to Rank datasets, our method significantly outperforms some strong baselines including single-view ranking models commonly used and multi-view ranking models that do not impose view consistency on target data."25-02-2014,13.30 _ 15.00,Paper,Web Search and Advertising,Using Confidence Bounds for Efficient On-line Ranker Evaluation,"Masrour Zoghi, Shimon Whiteson, Maarten de Rijke, Remi Munos","A key challenge in information retrieval is that of online ranker evaluation: determining which one of a finite set of rankers performs the best in expectation on the basis of user clicks on presented document lists. When the presented lists are constructed using interleaved comparison methods, which interleave lists proposed by two different candidate rankers, then the problem of minimizing the total regret accumulated while evaluating the rankers can be formalized as a K-armed dueling bandits problem. In this paper, we propose a new method called relative confidence sampling (RCS) that aims to reduce cumulative regret by being less conservative than existing methods in eliminating rankers from contention. In addition, we present an empirical comparison between RCS and two state-of-the-art methods, relative upper confidence bound and SAVAGE. The results demonstrate that RCS can substantially outperform these alternatives on several large learning to rank datasets."25-02-2014,13.30 _ 15.00,Paper,Web Search and Advertising,Adapting Deep RankNet for Personalized Search,"Yang Song, Hongning Wang, Xiaodong He","RankNet is one of the widely adopted ranking models for web search tasks. However, adapting a generic RankNet for personalized search is little studied. In this paper, we first continue-trained a variety of RankNets with different number of hidden layers and network structures over a previously trained global RankNet model, and observed that a deep neural network with five hidden layers gives the best performance. To further improve the performance of adaptation, we propose a set of novel methods categorized into two groups. In the first group, three methods are proposed to properly assess the usefulness of each adaptation instance and only leverage the most informative instances to adapt a user-specific RankNet model. These assessments are based on KL-divergence, click entropy or a heuristic to ignore top clicks in adaptation queries. In the second group, two methods are proposed to regularize the training of the neural network in RankNet: one of these methods regularize the error back-propagation via a truncated gradient approach,while the other method limits the depth of the back propagation when adapting the neural network. We empirically evaluate our approaches using a large-scale real-world data set. Experimental results exhibit that our methods all give significant improvements over a strong baseline ranking system, and the truncated gradient approach gives the best performance, significantly better than all others."25-02-2014,13.30 _ 15.00,Paper,Web Search and Advertising,Search Engine Click Spam Detection Based on Bipartite Graph Propagation,"Xin Li, Min Zhang, Yiqun Liu, Shaoping Ma, Yijiang Jin, Liyun Ru","Using search engines to retrieve information has become an important part of people's daily lives. For most search engines, click information is an important factor in document ranking. As a result, some websites cheat to obtain a higher rank by fraudulently increasing clicks to their pages, which is referred to as ñClick Spamî. Based on an analysis of the features of fraudulent clicks, a novel automatic click spam detection approach is proposed in this paper, which consists of 1. modeling user sessions with a triple sequence, which, to the best of our knowledge, takes into account not only the user action but also the action objective and the time interval between actions for the first time; 2. using the user-session bipartite graph propagation algorithm to take advantage of cheating users to find more cheating sessions; and 3.using the pattern-session bipartite graph propagation algorithm to obtain cheating session patterns to achieve higher precision and recall of click spam detection. Experimental results based on a Chinese commercial search engine using real-world log data containing approximately 80 million user clicks per day show that 2.6% of all clicks were detected as spam with a precision of up to 97%."25-02-2014,13.30 _ 15.00,Paper,Web Search and Advertising,Sampling Dilemma: Towards Effective Data Sampling for Click Prediction in Sponsored Search,"Jun Feng, Jian Bian, Taifeng Wang, Wei Chen, Xiaoyan Zhu, Tie-Yan Liu","Precise prediction of the probability that users click on ads plays a key role in sponsored search. State-of-the-art sponsored search systems typically employ a machine learning approach to conduct click prediction. While paying much attention to extracting useful features and building effective models, previous studies have overshadowed seemingly less obvious but essentially important challenges in terms of data sampling. To fulfill the learning objective of click prediction, it is not only necessary to ensure that the sampled training data implies the similar input distribution compared with the real world one, but also to guarantee that the sampled training data yield the consistent conditional output distribution, i.e. click-through rate (CTR), with the real world data. However, due to the sparseness of clicks in sponsored search, it is a bit contradictory to address these two challenges simultaneously. In this paper, we first take a theoretical analysis to reveal this sampling dilemma, followed by a thorough data analysis which demonstrates that the straightforward random sampling method may not be effective to balance these two kinds of consistency in sampling dilemma simultaneously. To address this problem, we propose a new sampling algorithm which can succeed in retaining the consistency between the sampled data and real world in terms of both input distribution and conditional output distribution. Large scale evaluations on the click-through logs from a commercial search engine demonstrate that this new sampling algorithm can effectively address the sampling dilemma. Further experiments illustrate that, by using the training data obtained by our new sampling algorithm, we can learn the model with much higher accuracy in click prediction."25-02-2014,13.30 _ 15.00,Paper,Web Search and Advertising,Exploiting Contextual Factors for Click Modeling in Sponsored Search,"Dawei Yin, Shike Mei, Bin Cao, Jian-Tao Sun, Brian D. Davison","Sponsored search is the primary business for todayÍs commercial search engines. Accurate prediction of the Click-Through Rate (CTR) for ads is key to displaying relevant ads to users. In this paper, we systematically study the two kinds of contextual factors influencing the CTR: 1) In micro factors, we focus on the factors for mainline ads, including ad depth, query diversity, ad interaction. 2) In macro factors, we try to understand the correlations of clicks between organic search and sponsored search. Based on this data analysis, we propose novel click models which harvest these new explored factors. To the best of our knowledge, this is the first paper to examine and model the effects of the above contextual factors in sponsored search. Extensive experiments on large-scale real-world datasets show that by incorporating these contextual factors, our novel click models can outperform state-of-the-art methods."